{
  "id": "ambiguous-calls",
  "title": "ambiguous-calls",
  "group": "maintenance",
  "owner": "ENGINE",
  "status": "shipped",
  "since": "0.91.0-alpha",
  "summary": "Resolver-coverage diagnostic that reports call sites the engine could not pin to exactly one target -- unresolved or ambiguous calls",
  "wikiPage": "ambiguous-calls",
  "surfaces": [
    {
      "type": "cli",
      "verb": "ambiguous-calls",
      "usage": "drag-lint ambiguous-calls [--qname <Foo.Bar>|--file <file>] --db PATH [--json] (resolver-coverage diagnostic: unresolved/ambiguous call sites)",
      "flags": [
        {
          "name": "--qname",
          "arg": "<Foo.Bar>"
        },
        {
          "name": "--file",
          "arg": "<file>"
        },
        {
          "name": "--db",
          "arg": "PATH"
        },
        {
          "name": "--json"
        }
      ],
      "helpOrder": 78,
      "help": ["  drag-lint ambiguous-calls [--qname <Foo.Bar>|--file <file>] --db PATH [--json]   (resolver-coverage diagnostic: unresolved/ambiguous call sites)"]
    }
  ],
  "audience": "both",
  "requires": ["index"]
}
