{
  "id": "doc-forget",
  "title": "doc-forget",
  "group": "documentation",
  "owner": "ENGINE",
  "status": "shipped",
  "since": "1.17.0-alpha",
  "summary": "Reap or rename the project tags on inbound documentation facts; a dry run unless told to apply",
  "intro": "Read this when documentation facts carry the wrong project tag, or tags need cleaning up. doc-forget removes or renames project tags on inbound doc facts for a file or folder, and is a dry run unless you pass --apply.",
  "wikiPage": "Features",
  "surfaces": [
    {
      "type": "cli",
      "verb": "doc-forget",
      "usage": "drag-lint doc-forget --scope <file.pas|dir> (--project <Tag> [--rename <Tag>=<New>] | --untagged | --list-tags) [--apply|--no-backup] - reap project tags on inbound doc facts",
      "flags": [
        {
          "name": "--scope",
          "arg": "<file.pas|dir>"
        },
        {
          "name": "--project",
          "arg": "<Tag>"
        },
        {
          "name": "--rename",
          "arg": "<Tag>"
        },
        {
          "name": "--untagged"
        },
        {
          "name": "--list-tags"
        },
        {
          "name": "--apply"
        },
        {
          "name": "--no-backup"
        }
      ],
      "helpOrder": 56,
      "help": ["  drag-lint doc-forget --scope <file.pas|dir> (--project <Tag> [--rename <Tag>=<New>] | --untagged | --list-tags) [--apply|--no-backup]   - reap project tags on inbound doc facts", "     --project removes that tag (entries whose set empties go); --rename <Tag>=<New> renames it and alone is enough (its left side names the tag; if --project is also given it must match); --untagged drops untagged entries in blocks that carry tags; --list-tags counts every tag in scope. Dry run unless --apply"]
    },
    {
      "type": "ide-menu",
      "path": "drag-lint > Generate & Export > Forget Documentation Project Tag...",
      "steps": ["Choose drag-lint > Generate & Export > Forget Documentation Project Tag...", "Enter the project tag to forget; the scope is the active project's folder and --rename is CLI-only", "Choose whether to apply: without applying it is a dry run (preview only)"]
    },
    {
      "type": "ide-menu",
      "path": "drag-lint > Generate & Export > List Documentation Project Tags",
      "steps": ["Choose drag-lint > Generate & Export > List Documentation Project Tags", "The project tags on inbound documentation facts are listed"]
    }
  ],
  "audience": "both",
  "questions": [
    {
      "ask": "Documentation facts carry the wrong project tag -- how do I list the tags?",
      "command": "drag-lint doc-forget --scope <dir> --list-tags"
    },
    {
      "ask": "How do I rename or remove a project tag?",
      "command": "drag-lint doc-forget --scope <dir> --project <Tag> --rename <Tag>=<New> --apply"
    }
  ],
  "notes": "seed: needs own page",
  "verified": {
    "date": "2026-10-26",
    "by": "ENGINE",
    "build": "1.35.1-alpha",
    "surfaceHash": "cce9d62a0bd3dd03c69c9ef8cd0e9019680b440f770c16985d98dbaae6edb5c6"
  }
}
