{
  "id": "document-project",
  "title": "Document project",
  "group": "documentation",
  "owner": "ENGINE",
  "status": "shipped",
  "since": "0.90.0-alpha",
  "summary": "Generates or repairs managed DocInsight comments for every public declaration the project owns, starting from a Structure-tree node's project",
  "wikiPage": "Document-project",
  "surfaces": [
    {
      "type": "ide-context",
      "host": "Structure form",
      "caption": "Document project"
    },
    {
      "type": "cli",
      "verb": "document",
      "usage": "drag-lint document --qname <Foo.TBar.Baz> [--apply|--json|--no-backup|--migrate-pure] [--db PATH] - generate/repair a managed DocInsight comment",
      "flags": [
        {
          "name": "--qname",
          "arg": "<Foo.TBar.Baz>"
        },
        {
          "name": "--apply"
        },
        {
          "name": "--json"
        },
        {
          "name": "--no-backup"
        },
        {
          "name": "--migrate-pure"
        },
        {
          "name": "--db",
          "arg": "PATH"
        }
      ]
    }
  ],
  "audience": "both"
}
