{
  "id": "query-descendants",
  "title": "query descendants",
  "group": "search-navigation",
  "owner": "ENGINE",
  "status": "shipped",
  "since": "1.2.2-alpha",
  "summary": "The reverse of query ancestors: lists every class that descends from a given ancestor, across all scanned databases",
  "intro": "Read this to answer what derives from this class. It lists every class that descends from a given ancestor across all scanned indexes; derived interfaces are left out on purpose.",
  "wikiPage": "query-descendants",
  "surfaces": [
    {
      "type": "cli",
      "verb": "query",
      "sub": "descendants",
      "usage": "drag-lint query descendants --of <ancestor> [--db ...] [--json] (the REVERSE of ancestors: every CLASS descending from <ancestor>, across all scanned DBs. Derived INTERFACES are deliberately excluded -- this backs the conversion editor's class pickers. exit 1 = no such ancestor)",
      "flags": [
        {
          "name": "--of",
          "arg": "<ancestor>"
        },
        {
          "name": "--db"
        },
        {
          "name": "--json"
        }
      ],
      "helpOrder": 12,
      "help": ["  drag-lint query descendants  --of <ancestor> [--db ...] [--json]   (the REVERSE of ancestors: every CLASS descending from <ancestor>, across all scanned DBs. Derived INTERFACES are deliberately excluded -- this backs the conversion editor's class pickers. exit 1 = no such ancestor)"]
    },
    {
      "type": "ide-menu",
      "path": "drag-lint > Inspect Symbol > Descendants of Class...",
      "steps": ["Needs an index of the project", "drag-lint > Inspect Symbol > Descendants of Class...", "Enter the class; every descending class is listed"]
    }
  ],
  "audience": "both",
  "questions": [
    {
      "ask": "Which classes descend from this ancestor?",
      "command": "drag-lint query descendants --of <ancestor> --db <db>"
    },
    {
      "ask": "Can I get them as JSON?",
      "command": "drag-lint query descendants --of <ancestor> --json"
    }
  ],
  "verified": {
    "date": "2026-10-21",
    "by": "ENGINE",
    "build": "1.33.0-alpha",
    "surfaceHash": "c153459c27cc909884c16bd94b262b6eea72bf47a405d0980f792b089dba0cf6"
  }
}
