{
  "id": "generate-test-helper-csv",
  "title": "Forms for testers (CSV)",
  "group": "graphs-reports",
  "owner": "CHARTS",
  "status": "shipped",
  "since": "0.44.0-alpha",
  "summary": "A CSV of a project's forms, one row per form, telling a tester how to reach each one from the main form",
  "intro": "Hand a tester one spreadsheet that says how to reach every form: drag-lint > Reports > Forms for testers (CSV)... or `drag-lint forms-csv --project <dproj> --db <db>`. Each row gives the menu, ribbon or tab path, the control, the handler, the modal flag and the preconditions per hop; popup forms the index cannot trace go under popupForms in drag-lint-project.json. Needs the project index.",
  "wikiPage": "Generate-Test-Helper-CSV",
  "surfaces": [
    {
      "type": "ide-menu",
      "path": "drag-lint > Reports > Forms for testers (CSV)..."
    },
    {
      "type": "cli",
      "verb": "forms-csv",
      "usage": "drag-lint forms-csv --project <X.dproj> --db <file.sqlite> [--output <f.csv>] [--root <TfrmMAIN>] (tester CSV, one row per form: menu/ribbon/tab path, control, handler, modal, confidence)",
      "flags": [
        {
          "name": "--project",
          "arg": "<X.dproj>"
        },
        {
          "name": "--db",
          "arg": "<file.sqlite>"
        },
        {
          "name": "--output",
          "arg": "<f.csv>"
        },
        {
          "name": "--root",
          "arg": "<TfrmMAIN>"
        }
      ]
    }
  ],
  "audience": "both",
  "requires": ["index"],
  "lastVerified": {
    "date": "2026-10-06",
    "by": "session 71ca37e7-00ea-4eb4-aceb-c1274bd19bce",
    "build": "1.26.1-alpha"
  }
}
