{
  "id": "full-compile-sweep",
  "title": "Full Compile Sweep",
  "group": "compiler",
  "owner": "ENGINE",
  "status": "shipped",
  "since": "1.2.0-alpha",
  "summary": "Recompiles a project's stale units and refreshes its stored compiler findings, forcing a full build rather than the default stale-count threshold",
  "wikiPage": "Full-Compile-Sweep",
  "surfaces": [
    {
      "type": "ide-menu",
      "path": "drag-lint > Full Compile Sweep"
    },
    {
      "type": "cli",
      "verb": "refresh-findings",
      "usage": "drag-lint refresh-findings --project <X.dproj> [--db <db>] [--full] [--json] (recompile stale units + refresh compiler_findings; >=2 stale -> full build; no --db = the project's own DB)",
      "flags": [
        {
          "name": "--project",
          "arg": "<X.dproj>"
        },
        {
          "name": "--db",
          "arg": "<db>"
        },
        {
          "name": "--full"
        },
        {
          "name": "--json"
        }
      ]
    }
  ],
  "audience": "both",
  "requires": ["index"]
}
